{
  "code": "NW",
  "nom": {
    "fr": "Nidwald",
    "de": "Nidwalden"
  },
  "chef_lieu": "Stans",
  "langues": [
    "de"
  ],
  "population": 44000,
  "population_annee": 2023,
  "afc_cantonale": {
    "nom": "Administration fiscale — Nidwald",
    "url": "https://www.nw.ch/steuerverwaltung"
  },
  "notariat": "mixte",
  "fiscalite": {
    "taux_pm_effectif_indicatif": 12.0,
    "impot_fortune_pp": true,
    "droits_mutation_immo_pct": 0.0,
    "impot_successoral_descendants": false
  },
  "particularites": [],
  "sources": [
    {
      "url": "https://www.estv.admin.ch",
      "consulte_le": "2026-05-10",
      "note": "AFC fédérale — point d'entrée"
    },
    {
      "url": "https://www.nw.ch/steuerverwaltung",
      "consulte_le": "2026-05-10",
      "note": "Administration cantonale"
    }
  ]
}
