{
  "code": "SH",
  "nom": {
    "fr": "Schaffhouse",
    "de": "Schaffhausen"
  },
  "chef_lieu": "Schaffhouse",
  "langues": [
    "de"
  ],
  "population": 84000,
  "population_annee": 2023,
  "afc_cantonale": {
    "nom": "Administration fiscale — Schaffhouse",
    "url": "https://sh.ch/CMS/Webseite/Kanton-Schaffhausen/Beh-rde/Verwaltung/Finanzdepartement/Steuerverwaltung-12120-DE.html"
  },
  "notariat": "libre",
  "fiscalite": {
    "taux_pm_effectif_indicatif": 13.8,
    "impot_fortune_pp": true,
    "droits_mutation_immo_pct": 1.5,
    "impot_successoral_descendants": false
  },
  "particularites": [],
  "sources": [
    {
      "url": "https://www.estv.admin.ch",
      "consulte_le": "2026-05-10",
      "note": "AFC fédérale — point d'entrée"
    },
    {
      "url": "https://sh.ch/CMS/Webseite/Kanton-Schaffhausen/Beh-rde/Verwaltung/Finanzdepartement/Steuerverwaltung-12120-DE.html",
      "consulte_le": "2026-05-10",
      "note": "Administration cantonale"
    }
  ]
}
