{
  "code": "BS",
  "nom": {
    "fr": "Bâle-Ville",
    "de": "Basel-Stadt"
  },
  "chef_lieu": "Bâle",
  "langues": [
    "de"
  ],
  "population": 196000,
  "population_annee": 2023,
  "afc_cantonale": {
    "nom": "Administration fiscale — Bâle-Ville",
    "url": "https://www.steuerverwaltung.bs.ch/"
  },
  "notariat": "mixte",
  "fiscalite": {
    "taux_pm_effectif_indicatif": 13.0,
    "impot_fortune_pp": true,
    "droits_mutation_immo_pct": 3.0,
    "impot_successoral_descendants": false
  },
  "particularites": [],
  "sources": [
    {
      "url": "https://www.estv.admin.ch",
      "consulte_le": "2026-05-10",
      "note": "AFC fédérale — point d'entrée"
    },
    {
      "url": "https://www.steuerverwaltung.bs.ch/",
      "consulte_le": "2026-05-10",
      "note": "Administration cantonale"
    }
  ]
}
