{
  "code": "AI",
  "nom": {
    "fr": "Appenzell Rhodes-Intérieures",
    "de": "Appenzell Innerrhoden"
  },
  "chef_lieu": "Appenzell",
  "langues": [
    "de"
  ],
  "population": 17000,
  "population_annee": 2023,
  "afc_cantonale": {
    "nom": "Administration fiscale — Appenzell Rhodes-Intérieures",
    "url": "https://www.ai.ch/themen/finanzen-und-steuern"
  },
  "notariat": "mixte",
  "fiscalite": {
    "taux_pm_effectif_indicatif": 11.5,
    "impot_fortune_pp": true,
    "droits_mutation_immo_pct": 1.0,
    "impot_successoral_descendants": true
  },
  "particularites": [],
  "sources": [
    {
      "url": "https://www.estv.admin.ch",
      "consulte_le": "2026-05-10",
      "note": "AFC fédérale — point d'entrée"
    },
    {
      "url": "https://www.ai.ch/themen/finanzen-und-steuern",
      "consulte_le": "2026-05-10",
      "note": "Administration cantonale"
    }
  ]
}
