{
  "code": "GE",
  "nom": {
    "fr": "Genève"
  },
  "chef_lieu": "Genève",
  "langues": [
    "fr"
  ],
  "population": 514000,
  "population_annee": 2023,
  "afc_cantonale": {
    "nom": "Administration fiscale — Genève",
    "url": "https://www.ge.ch/organisation/administration-fiscale-cantonale"
  },
  "notariat": "latin",
  "fiscalite": {
    "taux_pm_effectif_indicatif": 14.0,
    "impot_fortune_pp": true,
    "droits_mutation_immo_pct": 3.0,
    "impot_successoral_descendants": false
  },
  "particularites": [
    "LDTR : loi sur les démolitions, transformations et rénovations — autorisations strictes",
    "Frontaliers F : impôt à la source, accord franco-suisse",
    "Bouclier fiscal cantonal : plafond charge fiscale fortune + revenu"
  ],
  "sources": [
    {
      "url": "https://www.estv.admin.ch",
      "consulte_le": "2026-05-10",
      "note": "AFC fédérale — point d'entrée"
    },
    {
      "url": "https://www.ge.ch/organisation/administration-fiscale-cantonale",
      "consulte_le": "2026-05-10",
      "note": "Administration cantonale"
    }
  ]
}
