{
  "code": "JU",
  "nom": {
    "fr": "Jura"
  },
  "chef_lieu": "Delémont",
  "langues": [
    "fr"
  ],
  "population": 74000,
  "population_annee": 2023,
  "afc_cantonale": {
    "nom": "Administration fiscale — Jura",
    "url": "https://www.jura.ch/DFI/CTR.html"
  },
  "notariat": "latin",
  "fiscalite": {
    "taux_pm_effectif_indicatif": 16.0,
    "impot_fortune_pp": true,
    "droits_mutation_immo_pct": 2.1,
    "impot_successoral_descendants": true
  },
  "particularites": [],
  "sources": [
    {
      "url": "https://www.estv.admin.ch",
      "consulte_le": "2026-05-10",
      "note": "AFC fédérale — point d'entrée"
    },
    {
      "url": "https://www.jura.ch/DFI/CTR.html",
      "consulte_le": "2026-05-10",
      "note": "Administration cantonale"
    }
  ]
}
