{
  "code": "AR",
  "nom": {
    "fr": "Appenzell Rhodes-Extérieures",
    "de": "Appenzell Ausserrhoden"
  },
  "chef_lieu": "Herisau",
  "langues": [
    "de"
  ],
  "population": 56000,
  "population_annee": 2023,
  "afc_cantonale": {
    "nom": "Administration fiscale — Appenzell Rhodes-Extérieures",
    "url": "https://www.ar.ch/verwaltung/departement-finanzen/steuerverwaltung/"
  },
  "notariat": "libre",
  "fiscalite": {
    "taux_pm_effectif_indicatif": 13.0,
    "impot_fortune_pp": true,
    "droits_mutation_immo_pct": 1.0,
    "impot_successoral_descendants": false
  },
  "particularites": [],
  "sources": [
    {
      "url": "https://www.estv.admin.ch",
      "consulte_le": "2026-05-10",
      "note": "AFC fédérale — point d'entrée"
    },
    {
      "url": "https://www.ar.ch/verwaltung/departement-finanzen/steuerverwaltung/",
      "consulte_le": "2026-05-10",
      "note": "Administration cantonale"
    }
  ]
}
