{
  "code": "SZ",
  "nom": {
    "fr": "Schwytz",
    "de": "Schwyz"
  },
  "chef_lieu": "Schwytz",
  "langues": [
    "de"
  ],
  "population": 165000,
  "population_annee": 2023,
  "afc_cantonale": {
    "nom": "Administration fiscale — Schwytz",
    "url": "https://www.sz.ch/behoerden/finanzdepartement/kantonale-steuerverwaltung.html"
  },
  "notariat": "mixte",
  "fiscalite": {
    "taux_pm_effectif_indicatif": 11.8,
    "impot_fortune_pp": true,
    "droits_mutation_immo_pct": 0.0,
    "impot_successoral_descendants": false
  },
  "particularites": [],
  "sources": [
    {
      "url": "https://www.estv.admin.ch",
      "consulte_le": "2026-05-10",
      "note": "AFC fédérale — point d'entrée"
    },
    {
      "url": "https://www.sz.ch/behoerden/finanzdepartement/kantonale-steuerverwaltung.html",
      "consulte_le": "2026-05-10",
      "note": "Administration cantonale"
    }
  ]
}
