{
  "code": "BE",
  "nom": {
    "fr": "Berne",
    "de": "Bern"
  },
  "chef_lieu": "Berne",
  "langues": [
    "de",
    "fr"
  ],
  "population": 1060000,
  "population_annee": 2023,
  "afc_cantonale": {
    "nom": "Administration fiscale — Berne",
    "url": "https://www.taxinfo.sv.fin.be.ch/"
  },
  "notariat": "mixte",
  "fiscalite": {
    "taux_pm_effectif_indicatif": 18.7,
    "impot_fortune_pp": true,
    "droits_mutation_immo_pct": 1.8,
    "impot_successoral_descendants": false
  },
  "particularites": [
    "Bilingue DE/FR (Jura bernois)"
  ],
  "sources": [
    {
      "url": "https://www.estv.admin.ch",
      "consulte_le": "2026-05-10",
      "note": "AFC fédérale — point d'entrée"
    },
    {
      "url": "https://www.taxinfo.sv.fin.be.ch/",
      "consulte_le": "2026-05-10",
      "note": "Administration cantonale"
    }
  ]
}
