{
  "code": "NE",
  "nom": {
    "fr": "Neuchâtel"
  },
  "chef_lieu": "Neuchâtel",
  "langues": [
    "fr"
  ],
  "population": 177000,
  "population_annee": 2023,
  "afc_cantonale": {
    "nom": "Administration fiscale — Neuchâtel",
    "url": "https://www.ne.ch/autorites/DFS/SCCO/"
  },
  "notariat": "latin",
  "fiscalite": {
    "taux_pm_effectif_indicatif": 13.6,
    "impot_fortune_pp": true,
    "droits_mutation_immo_pct": 3.3,
    "impot_successoral_descendants": true
  },
  "particularites": [],
  "sources": [
    {
      "url": "https://www.estv.admin.ch",
      "consulte_le": "2026-05-10",
      "note": "AFC fédérale — point d'entrée"
    },
    {
      "url": "https://www.ne.ch/autorites/DFS/SCCO/",
      "consulte_le": "2026-05-10",
      "note": "Administration cantonale"
    }
  ]
}
