{
  "code": "GL",
  "nom": {
    "fr": "Glaris",
    "de": "Glarus"
  },
  "chef_lieu": "Glaris",
  "langues": [
    "de"
  ],
  "population": 41000,
  "population_annee": 2023,
  "afc_cantonale": {
    "nom": "Administration fiscale — Glaris",
    "url": "https://www.gl.ch/verwaltung/finanzen-und-gesundheit/steuern.html"
  },
  "notariat": "mixte",
  "fiscalite": {
    "taux_pm_effectif_indicatif": 12.3,
    "impot_fortune_pp": true,
    "droits_mutation_immo_pct": 1.0,
    "impot_successoral_descendants": false
  },
  "particularites": [],
  "sources": [
    {
      "url": "https://www.estv.admin.ch",
      "consulte_le": "2026-05-10",
      "note": "AFC fédérale — point d'entrée"
    },
    {
      "url": "https://www.gl.ch/verwaltung/finanzen-und-gesundheit/steuern.html",
      "consulte_le": "2026-05-10",
      "note": "Administration cantonale"
    }
  ]
}
