{
  "code": "SG",
  "nom": {
    "fr": "Saint-Gall",
    "de": "St. Gallen"
  },
  "chef_lieu": "Saint-Gall",
  "langues": [
    "de"
  ],
  "population": 520000,
  "population_annee": 2023,
  "afc_cantonale": {
    "nom": "Administration fiscale — Saint-Gall",
    "url": "https://www.sg.ch/steuern-finanzen.html"
  },
  "notariat": "mixte",
  "fiscalite": {
    "taux_pm_effectif_indicatif": 14.5,
    "impot_fortune_pp": true,
    "droits_mutation_immo_pct": 1.0,
    "impot_successoral_descendants": false
  },
  "particularites": [],
  "sources": [
    {
      "url": "https://www.estv.admin.ch",
      "consulte_le": "2026-05-10",
      "note": "AFC fédérale — point d'entrée"
    },
    {
      "url": "https://www.sg.ch/steuern-finanzen.html",
      "consulte_le": "2026-05-10",
      "note": "Administration cantonale"
    }
  ]
}
