{
  "code": "AG",
  "nom": {
    "fr": "Argovie",
    "de": "Aargau"
  },
  "chef_lieu": "Aarau",
  "langues": [
    "de"
  ],
  "population": 720000,
  "population_annee": 2023,
  "afc_cantonale": {
    "nom": "Administration fiscale — Argovie",
    "url": "https://www.ag.ch/de/dfr/steuern"
  },
  "notariat": "mixte",
  "fiscalite": {
    "taux_pm_effectif_indicatif": 15.1,
    "impot_fortune_pp": true,
    "droits_mutation_immo_pct": 0.0,
    "impot_successoral_descendants": false
  },
  "particularites": [],
  "sources": [
    {
      "url": "https://www.estv.admin.ch",
      "consulte_le": "2026-05-10",
      "note": "AFC fédérale — point d'entrée"
    },
    {
      "url": "https://www.ag.ch/de/dfr/steuern",
      "consulte_le": "2026-05-10",
      "note": "Administration cantonale"
    }
  ]
}
