{
  "code": "TG",
  "nom": {
    "fr": "Thurgovie",
    "de": "Thurgau"
  },
  "chef_lieu": "Frauenfeld",
  "langues": [
    "de"
  ],
  "population": 287000,
  "population_annee": 2023,
  "afc_cantonale": {
    "nom": "Administration fiscale — Thurgovie",
    "url": "https://steuerverwaltung.tg.ch/"
  },
  "notariat": "mixte",
  "fiscalite": {
    "taux_pm_effectif_indicatif": 13.2,
    "impot_fortune_pp": true,
    "droits_mutation_immo_pct": 1.0,
    "impot_successoral_descendants": false
  },
  "particularites": [],
  "sources": [
    {
      "url": "https://www.estv.admin.ch",
      "consulte_le": "2026-05-10",
      "note": "AFC fédérale — point d'entrée"
    },
    {
      "url": "https://steuerverwaltung.tg.ch/",
      "consulte_le": "2026-05-10",
      "note": "Administration cantonale"
    }
  ]
}
