{
  "code": "ZG",
  "nom": {
    "fr": "Zoug",
    "de": "Zug"
  },
  "chef_lieu": "Zoug",
  "langues": [
    "de"
  ],
  "population": 130000,
  "population_annee": 2023,
  "afc_cantonale": {
    "nom": "Administration fiscale — Zoug",
    "url": "https://www.zg.ch/behoerden/finanzdirektion/steuerverwaltung"
  },
  "notariat": "mixte",
  "fiscalite": {
    "taux_pm_effectif_indicatif": 11.85,
    "impot_fortune_pp": true,
    "droits_mutation_immo_pct": 0.0,
    "impot_successoral_descendants": false
  },
  "particularites": [
    "Fiscalité PM parmi les plus basses CH",
    "Pas de droits de mutation"
  ],
  "sources": [
    {
      "url": "https://www.estv.admin.ch",
      "consulte_le": "2026-05-10",
      "note": "AFC fédérale — point d'entrée"
    },
    {
      "url": "https://www.zg.ch/behoerden/finanzdirektion/steuerverwaltung",
      "consulte_le": "2026-05-10",
      "note": "Administration cantonale"
    }
  ]
}
