{
  "code": "VS",
  "nom": {
    "fr": "Valais",
    "de": "Wallis"
  },
  "chef_lieu": "Sion",
  "langues": [
    "fr",
    "de"
  ],
  "population": 353000,
  "population_annee": 2023,
  "afc_cantonale": {
    "nom": "Administration fiscale — Valais",
    "url": "https://www.vs.ch/scc"
  },
  "notariat": "latin",
  "fiscalite": {
    "taux_pm_effectif_indicatif": 14.0,
    "impot_fortune_pp": true,
    "droits_mutation_immo_pct": 1.5,
    "impot_successoral_descendants": false
  },
  "particularites": [
    "Bilingue FR/DE (Haut-Valais germanophone)",
    "Forte activité résidences secondaires (LRS)"
  ],
  "sources": [
    {
      "url": "https://www.estv.admin.ch",
      "consulte_le": "2026-05-10",
      "note": "AFC fédérale — point d'entrée"
    },
    {
      "url": "https://www.vs.ch/scc",
      "consulte_le": "2026-05-10",
      "note": "Administration cantonale"
    }
  ]
}
