{
  "code": "OW",
  "nom": {
    "fr": "Obwald",
    "de": "Obwalden"
  },
  "chef_lieu": "Sarnen",
  "langues": [
    "de"
  ],
  "population": 38000,
  "population_annee": 2023,
  "afc_cantonale": {
    "nom": "Administration fiscale — Obwald",
    "url": "https://www.ow.ch/steuern"
  },
  "notariat": "mixte",
  "fiscalite": {
    "taux_pm_effectif_indicatif": 12.7,
    "impot_fortune_pp": true,
    "droits_mutation_immo_pct": 0.0,
    "impot_successoral_descendants": false
  },
  "particularites": [],
  "sources": [
    {
      "url": "https://www.estv.admin.ch",
      "consulte_le": "2026-05-10",
      "note": "AFC fédérale — point d'entrée"
    },
    {
      "url": "https://www.ow.ch/steuern",
      "consulte_le": "2026-05-10",
      "note": "Administration cantonale"
    }
  ]
}
